{
  "generated_at": "2026-07-07",
  "source_report_generated_at": "2026-07-07",
  "summary": {
    "total": 106,
    "by_review_type": {
      "field_conflict": 9,
      "uncertain_match": 6,
      "new_candidate": 87,
      "auto_skipped_field_update": 4
    },
    "by_priority": {
      "high": 9,
      "medium": 97
    }
  },
  "items": [
    {
      "review_type": "field_conflict",
      "priority": "high",
      "reason": "기존 카드의 yes/no 값과 roadview 초안 값이 충돌하므로 출처 재확인 필요",
      "existing": {
        "id": "jeju_rest_sinsan_015",
        "name": "신산공원",
        "region": "제주시",
        "category": "rest_area",
        "verification_status": "partial"
      },
      "draft": {
        "id": "jeju_roadview_place_002",
        "name": "신산공원",
        "region": "제주시",
        "category": "rest_area",
        "verification_status": "partial"
      },
      "match_confidence": 1.0,
      "match_reasons": [
        "name_exact",
        "region_overlap",
        "category_match"
      ],
      "field_conflicts": [
        {
          "field": "rest_area",
          "existing_state": "yes",
          "existing_note": "도심 공원 산책과 휴식 가능",
          "draft_state": "no",
          "draft_note": "휴게실 보유 여부: N",
          "draft_source_ref": "jeju_roadview_facility_status",
          "recommended_action": "review_and_update_existing_card"
        }
      ]
    },
    {
      "review_type": "field_conflict",
      "priority": "high",
      "reason": "기존 카드의 yes/no 값과 roadview 초안 값이 충돌하므로 출처 재확인 필요",
      "existing": {
        "id": "jeju_forest_halla_005",
        "name": "한라수목원",
        "region": "제주시",
        "category": "forest",
        "verification_status": "verified"
      },
      "draft": {
        "id": "jeju_roadview_place_009",
        "name": "한라수목원",
        "region": "제주시",
        "category": "forest",
        "verification_status": "partial"
      },
      "match_confidence": 1.0,
      "match_reasons": [
        "name_exact",
        "region_overlap",
        "category_match"
      ],
      "field_conflicts": [
        {
          "field": "rental_or_assistance",
          "existing_state": "yes",
          "existing_note": "휠체어와 유아차 대여 정보 있음",
          "draft_state": "no",
          "draft_note": "휠체어 대여 가능 여부: N",
          "draft_source_ref": "jeju_roadview_facility_status",
          "recommended_action": "review_and_update_existing_card"
        }
      ]
    },
    {
      "review_type": "uncertain_match",
      "priority": "medium",
      "reason": "장소명이 부분 일치하여 동일 장소 여부 확인 필요",
      "existing": {
        "id": "jeju_sea_songaksan_023",
        "name": "송악산",
        "region": "서귀포시 대정읍",
        "category": "sea",
        "verification_status": "needs_check"
      },
      "draft": {
        "id": "jeju_roadview_place_021",
        "name": "송악산전망대",
        "region": "서귀포시",
        "category": "other",
        "verification_status": "partial"
      },
      "match_confidence": 0.73,
      "match_reasons": [
        "name_contains",
        "region_overlap"
      ],
      "field_conflicts": []
    },
    {
      "review_type": "field_conflict",
      "priority": "high",
      "reason": "기존 카드의 yes/no 값과 roadview 초안 값이 충돌하므로 출처 재확인 필요",
      "existing": {
        "id": "jeju_forest_cheonjiyeon_014",
        "name": "천지연폭포",
        "region": "서귀포시",
        "category": "forest",
        "verification_status": "partial"
      },
      "draft": {
        "id": "jeju_roadview_place_035",
        "name": "천지연폭포",
        "region": "서귀포시",
        "category": "sea",
        "verification_status": "partial"
      },
      "match_confidence": 0.98,
      "match_reasons": [
        "name_exact",
        "region_overlap"
      ],
      "field_conflicts": [
        {
          "field": "rental_or_assistance",
          "existing_state": "yes",
          "existing_note": "휠체어, 유아차 대여 가능",
          "draft_state": "no",
          "draft_note": "휠체어 대여 가능 여부: N",
          "draft_source_ref": "jeju_roadview_facility_status",
          "recommended_action": "review_and_update_existing_card"
        }
      ]
    },
    {
      "review_type": "uncertain_match",
      "priority": "medium",
      "reason": "장소명이 부분 일치하여 동일 장소 여부 확인 필요",
      "existing": {
        "id": "jeju_indoor_haenyeo_024",
        "name": "제주해녀박물관",
        "region": "제주시 구좌읍",
        "category": "indoor",
        "verification_status": "partial"
      },
      "draft": {
        "id": "jeju_roadview_place_042",
        "name": "해녀박물관",
        "region": "제주시",
        "category": "indoor",
        "verification_status": "partial"
      },
      "match_confidence": 0.75,
      "match_reasons": [
        "name_contains",
        "region_overlap",
        "category_match"
      ],
      "field_conflicts": []
    },
    {
      "review_type": "field_conflict",
      "priority": "high",
      "reason": "기존 카드의 yes/no 값과 roadview 초안 값이 충돌하므로 출처 재확인 필요",
      "existing": {
        "id": "jeju_indoor_mandeok_museum_009",
        "name": "김만덕기념관",
        "region": "제주시",
        "category": "indoor",
        "verification_status": "partial"
      },
      "draft": {
        "id": "jeju_roadview_place_044",
        "name": "김만덕기념관",
        "region": "제주시",
        "category": "indoor",
        "verification_status": "partial"
      },
      "match_confidence": 1.0,
      "match_reasons": [
        "name_exact",
        "region_overlap",
        "category_match"
      ],
      "field_conflicts": [
        {
          "field": "rental_or_assistance",
          "existing_state": "yes",
          "existing_note": "휠체어 및 유아차 대여 가능",
          "draft_state": "no",
          "draft_note": "휠체어 대여 가능 여부: N",
          "draft_source_ref": "jeju_roadview_facility_status",
          "recommended_action": "review_and_update_existing_card"
        }
      ]
    },
    {
      "review_type": "field_conflict",
      "priority": "high",
      "reason": "기존 카드의 yes/no 값과 roadview 초안 값이 충돌하므로 출처 재확인 필요",
      "existing": {
        "id": "jeju_forest_healing_001",
        "name": "서귀포 치유의숲",
        "region": "서귀포시",
        "category": "forest",
        "verification_status": "partial"
      },
      "draft": {
        "id": "jeju_roadview_place_049",
        "name": "서귀포치유의숲",
        "region": "서귀포시",
        "category": "forest",
        "verification_status": "partial"
      },
      "match_confidence": 1.0,
      "match_reasons": [
        "name_exact",
        "region_overlap",
        "category_match"
      ],
      "field_conflicts": [
        {
          "field": "rest_area",
          "existing_state": "yes",
          "existing_note": "숲길과 쉼팡 등 휴식 가능 구간이 있으나 이용 가능 구간 확인 필요",
          "draft_state": "no",
          "draft_note": "휴게실 보유 여부: N",
          "draft_source_ref": "jeju_roadview_facility_status",
          "recommended_action": "review_and_update_existing_card"
        },
        {
          "field": "rental_or_assistance",
          "existing_state": "yes",
          "existing_note": "휠체어와 유아차 대여 가능 정보 있음",
          "draft_state": "no",
          "draft_note": "휠체어 대여 가능 여부: N",
          "draft_source_ref": "jeju_roadview_facility_status",
          "recommended_action": "review_and_update_existing_card"
        }
      ]
    },
    {
      "review_type": "field_conflict",
      "priority": "high",
      "reason": "기존 카드의 yes/no 값과 roadview 초안 값이 충돌하므로 출처 재확인 필요",
      "existing": {
        "id": "jeju_indoor_lee_jung_seop_034",
        "name": "이중섭미술관",
        "region": "서귀포시",
        "category": "indoor",
        "verification_status": "needs_check"
      },
      "draft": {
        "id": "jeju_roadview_place_050",
        "name": "이중섭미술관",
        "region": "서귀포시",
        "category": "indoor",
        "verification_status": "partial"
      },
      "match_confidence": 1.0,
      "match_reasons": [
        "name_exact",
        "region_overlap",
        "category_match"
      ],
      "field_conflicts": [
        {
          "field": "accessible_toilet",
          "existing_state": "no",
          "existing_note": "장애인 화장실 공사 중 폐쇄 정보 있음",
          "draft_state": "yes",
          "draft_note": "장애인 화장실 보유 수: 2개",
          "draft_source_ref": "jeju_roadview_facility_status",
          "recommended_action": "review_and_update_existing_card"
        }
      ]
    },
    {
      "review_type": "uncertain_match",
      "priority": "medium",
      "reason": "장소명이 부분 일치하여 동일 장소 여부 확인 필요",
      "existing": {
        "id": "jeju_forest_saryeoni_002",
        "name": "사려니숲길 무장애나눔길",
        "region": "제주시 조천읍 / 서귀포시 표선면",
        "category": "forest",
        "verification_status": "verified"
      },
      "draft": {
        "id": "jeju_roadview_place_060",
        "name": "사려니숲길",
        "region": "제주시",
        "category": "forest",
        "verification_status": "partial"
      },
      "match_confidence": 0.75,
      "match_reasons": [
        "name_contains",
        "region_overlap",
        "category_match"
      ],
      "field_conflicts": []
    },
    {
      "review_type": "uncertain_match",
      "priority": "medium",
      "reason": "장소명이 부분 일치하여 동일 장소 여부 확인 필요",
      "existing": {
        "id": "jeju_forest_red_oreum_004",
        "name": "붉은오름자연휴양림",
        "region": "서귀포시 표선면",
        "category": "forest",
        "verification_status": "partial"
      },
      "draft": {
        "id": "jeju_roadview_place_061",
        "name": "붉은오름자연휴양림(무장애나눔숲길)",
        "region": "서귀포시",
        "category": "forest",
        "verification_status": "partial"
      },
      "match_confidence": 0.75,
      "match_reasons": [
        "name_contains",
        "region_overlap",
        "category_match"
      ],
      "field_conflicts": []
    },
    {
      "review_type": "uncertain_match",
      "priority": "medium",
      "reason": "장소명이 부분 일치하여 동일 장소 여부 확인 필요",
      "existing": {
        "id": "jeju_forest_red_oreum_004",
        "name": "붉은오름자연휴양림",
        "region": "서귀포시 표선면",
        "category": "forest",